{
  "schema_version": "1.0.0",
  "states": [
    "GUARD",
    "DRAIN",
    "PULL",
    "TRIAGE",
    "IMPLEMENT",
    "VERIFY",
    "REVIEW",
    "INTEGRATE",
    "CLEANUP",
    "PERSIST",
    "EXIT",
    "DONE",
    "HALTED"
  ],
  "edges": [
    {
      "state": "GUARD",
      "signal": "OK",
      "next": "DRAIN"
    },
    {
      "state": "GUARD",
      "signal": "HALT_REQUESTED",
      "next": "HALTED"
    },
    {
      "state": "GUARD",
      "signal": "RESTART_REQUIRED",
      "next": "HALTED"
    },
    {
      "state": "DRAIN",
      "signal": "OK",
      "next": "PULL"
    },
    {
      "state": "PULL",
      "signal": "OK",
      "next": "TRIAGE"
    },
    {
      "state": "PULL",
      "signal": "EMPTY",
      "next": "TRIAGE"
    },
    {
      "state": "TRIAGE",
      "signal": "OK",
      "next": "IMPLEMENT"
    },
    {
      "state": "TRIAGE",
      "signal": "EMPTY",
      "next": "VERIFY"
    },
    {
      "state": "IMPLEMENT",
      "signal": "OK",
      "next": "VERIFY"
    },
    {
      "state": "IMPLEMENT",
      "signal": "BLOCKED",
      "next": "VERIFY"
    },
    {
      "state": "VERIFY",
      "signal": "OK",
      "next": "REVIEW"
    },
    {
      "state": "VERIFY",
      "signal": "EMPTY",
      "next": "PERSIST"
    },
    {
      "state": "INTEGRATE",
      "signal": "OK",
      "next": "CLEANUP"
    },
    {
      "state": "CLEANUP",
      "signal": "OK",
      "next": "PERSIST"
    },
    {
      "state": "PERSIST",
      "signal": "OK",
      "next": "EXIT"
    },
    {
      "state": "EXIT",
      "signal": "refire",
      "next": "DONE"
    },
    {
      "state": "EXIT",
      "signal": "idle",
      "next": "DONE"
    },
    {
      "state": "EXIT",
      "signal": "break",
      "next": "DONE"
    },
    {
      "state": "EXIT",
      "signal": "halt",
      "next": "DONE"
    },
    {
      "state": "REVIEW",
      "signal": "OK",
      "next": "INTEGRATE"
    },
    {
      "state": "REVIEW",
      "signal": "EMPTY",
      "next": "PERSIST"
    }
  ],
  "terminal": [
    "DONE",
    "HALTED"
  ]
}